{"$schema":"https://json-schema.org/draft/2020-12/schema","$id":"https://gist.local/contracts/registry/v1/golden-fixture.schema.json","type":"object","additionalProperties":false,"required":["fixture_version","capability_id","contract_version","provider_id","tool_id","tool_version","binding_id","binding_version","cases"],"properties":{"fixture_version":{"const":"1"},"capability_id":{"type":"string"},"contract_version":{"type":"string"},"provider_id":{"type":"string"},"tool_id":{"type":"string"},"tool_version":{"type":"string"},"binding_id":{"type":"string"},"binding_version":{"type":"string"},"cases":{"type":"array","minItems":5,"items":{"type":"object","additionalProperties":false,"required":["name","capability_input","expected_provider_input","provider_output","expected_capability_output","expected_effect_classes"],"properties":{"name":{"type":"string"},"capability_input":{},"expected_provider_input":{},"provider_output":{},"expected_capability_output":{},"expected_effect_classes":{"type":"array","items":{"type":"string"}},"expected_error":{"type":"string"}}}}}}
