[
  {"fixture_version":"1","capability_id":"gist/identity/user.create","contract_version":"1.0.0","provider_id":"composio","tool_id":"composio/identity-user-create","tool_version":"2026-09-25","binding_id":"gist/composio/identity-user-create","binding_version":"1.0.0","cases":[{"name":"create","capability_input":{"external_ref":"synthetic-user-001","display_name":"Example User"},"expected_provider_input":{"external_ref":"synthetic-user-001","display_name":"Example User"},"provider_output":{"id":"provider-user-001"},"expected_capability_output":{"user_ref":"provider-user-001"},"expected_effect_classes":["mutation"]},{"name":"empty-name","capability_input":{"external_ref":"synthetic-user-002","display_name":""},"expected_provider_input":{"external_ref":"synthetic-user-002","display_name":""},"provider_output":{"error":"invalid_input"},"expected_capability_output":{"error":"validation_failed"},"expected_effect_classes":["mutation"]},{"name":"unicode","capability_input":{"external_ref":"synthetic-user-003","display_name":"Zoë Example"},"expected_provider_input":{"external_ref":"synthetic-user-003","display_name":"Zoë Example"},"provider_output":{"id":"provider-user-003"},"expected_capability_output":{"user_ref":"provider-user-003"},"expected_effect_classes":["mutation"]},{"name":"idempotent","capability_input":{"external_ref":"synthetic-user-001","display_name":"Example User"},"expected_provider_input":{"external_ref":"synthetic-user-001","display_name":"Example User"},"provider_output":{"id":"provider-user-001","replayed":true},"expected_capability_output":{"user_ref":"provider-user-001"},"expected_effect_classes":["mutation"]},{"name":"scope","capability_input":{"external_ref":"synthetic-user-004","display_name":"Scoped User"},"expected_provider_input":{"external_ref":"synthetic-user-004","display_name":"Scoped User"},"provider_output":{"error":"insufficient_scope"},"expected_capability_output":{"error":"forbidden"},"expected_effect_classes":["mutation"]}]},
  {"fixture_version":"1","capability_id":"gist/communication/message.send","contract_version":"1.0.0","provider_id":"github-mcp-server","tool_id":"github-mcp-server/communication-message-send","tool_version":"0.1.0","binding_id":"gist/github-mcp-server/communication-message-send","binding_version":"1.0.0","cases":[{"name":"send","capability_input":{"channel_ref":"repo:example/project#1","text":"Synthetic update"},"expected_provider_input":{"owner":"example","repo":"project","issue_number":1,"body":"Synthetic update"},"provider_output":{"id":42},"expected_capability_output":{"message_ref":"issue-comment:42"},"expected_effect_classes":["mutation"]},{"name":"empty","capability_input":{"channel_ref":"repo:example/project#1","text":""},"expected_provider_input":{"owner":"example","repo":"project","issue_number":1,"body":""},"provider_output":{"error":"validation_failed"},"expected_capability_output":{"error":"validation_failed"},"expected_effect_classes":["mutation"]},{"name":"unicode","capability_input":{"channel_ref":"repo:example/project#1","text":"Résumé"},"expected_provider_input":{"owner":"example","repo":"project","issue_number":1,"body":"Résumé"},"provider_output":{"id":43},"expected_capability_output":{"message_ref":"issue-comment:43"},"expected_effect_classes":["mutation"]},{"name":"repeat","capability_input":{"channel_ref":"repo:example/project#1","text":"Synthetic update"},"expected_provider_input":{"owner":"example","repo":"project","issue_number":1,"body":"Synthetic update"},"provider_output":{"id":42},"expected_capability_output":{"message_ref":"issue-comment:42"},"expected_effect_classes":["mutation"]},{"name":"missing-repo","capability_input":{"channel_ref":"repo:example/missing#1","text":"Synthetic update"},"expected_provider_input":{"owner":"example","repo":"missing","issue_number":1,"body":"Synthetic update"},"provider_output":{"error":"not_found"},"expected_capability_output":{"error":"not_found"},"expected_effect_classes":["mutation"]}]},
  {"fixture_version":"1","capability_id":"gist/document/parse","contract_version":"1.0.0","provider_id":"slack-web-api","tool_id":"slack-web-api/document-parse","tool_version":"2026-09-25","binding_id":"gist/slack-web-api/document-parse","binding_version":"1.0.0","cases":[{"name":"parse","capability_input":{"document_ref":"F_SYNTHETIC_001"},"expected_provider_input":{"file":"F_SYNTHETIC_001"},"provider_output":{"file":{"plain_text":"Synthetic document"}},"expected_capability_output":{"text":"Synthetic document"},"expected_effect_classes":["read_only"]},{"name":"missing","capability_input":{"document_ref":"F_MISSING"},"expected_provider_input":{"file":"F_MISSING"},"provider_output":{"error":"file_not_found"},"expected_capability_output":{"error":"not_found"},"expected_effect_classes":["read_only"]},{"name":"empty","capability_input":{"document_ref":"F_EMPTY"},"expected_provider_input":{"file":"F_EMPTY"},"provider_output":{"file":{"plain_text":""}},"expected_capability_output":{"text":""},"expected_effect_classes":["read_only"]},{"name":"unicode","capability_input":{"document_ref":"F_SYNTHETIC_002"},"expected_provider_input":{"file":"F_SYNTHETIC_002"},"provider_output":{"file":{"plain_text":"Résumé"}},"expected_capability_output":{"text":"Résumé"},"expected_effect_classes":["read_only"]},{"name":"scope","capability_input":{"document_ref":"F_PRIVATE"},"expected_provider_input":{"file":"F_PRIVATE"},"provider_output":{"error":"not_allowed"},"expected_capability_output":{"error":"forbidden"},"expected_effect_classes":["read_only"]}]}
]
